{
  "library_id": "plantlens.patterns.heat_exchanger",
  "version": "1.0.0",
  "component_type": "heat_exchanger",
  "display_name": "Heat exchanger (shell-and-tube, plate, condenser)",
  "description": "Failure patterns for heat exchangers and condensers: fouling, tube leaks, cooling flow loss, non-condensables and bypass control faults.",
  "asset_type_aliases": [],
  "library_type_aliases": [],
  "roles": [
    {
      "role": "hot_inlet_temperature",
      "quantity": "hot-side inlet temperature",
      "units": [
        "°C",
        "C"
      ],
      "signal_type_prefixes": [
        "process.temperature.hot_in"
      ],
      "name_hints": [
        "hot_in",
        "thi",
        "shell_in_t"
      ]
    },
    {
      "role": "hot_outlet_temperature",
      "quantity": "hot-side outlet temperature (usually the controlled temperature)",
      "units": [
        "°C",
        "C"
      ],
      "signal_type_prefixes": [
        "process.temperature.hot_out"
      ],
      "name_hints": [
        "hot_out",
        "tho",
        "shell_out_t"
      ]
    },
    {
      "role": "cold_inlet_temperature",
      "quantity": "cold-side / cooling medium inlet temperature",
      "units": [
        "°C",
        "C"
      ],
      "signal_type_prefixes": [
        "process.temperature.cold_in"
      ],
      "name_hints": [
        "cold_in",
        "tci",
        "cws_t"
      ]
    },
    {
      "role": "cold_outlet_temperature",
      "quantity": "cold-side / cooling medium outlet temperature",
      "units": [
        "°C",
        "C"
      ],
      "signal_type_prefixes": [
        "process.temperature.cold_out"
      ],
      "name_hints": [
        "cold_out",
        "tco",
        "cwr_t"
      ]
    },
    {
      "role": "approach_temperature",
      "quantity": "temperature approach (hot out − cold in), derived",
      "units": [
        "K",
        "°C"
      ],
      "signal_type_prefixes": [
        "derived.approach"
      ],
      "name_hints": [
        "approach"
      ]
    },
    {
      "role": "hot_flow",
      "quantity": "hot-side flow",
      "units": [
        "m3/h",
        "kg/h",
        "t/h"
      ],
      "signal_type_prefixes": [
        "process.flow.hot"
      ],
      "name_hints": [
        "hot_flow",
        "shell_flow"
      ]
    },
    {
      "role": "cold_flow",
      "quantity": "cold-side / cooling medium flow",
      "units": [
        "m3/h",
        "kg/h",
        "t/h"
      ],
      "signal_type_prefixes": [
        "process.flow.cold"
      ],
      "name_hints": [
        "cold_flow",
        "cw_flow",
        "tube_flow"
      ]
    },
    {
      "role": "ua",
      "quantity": "overall heat-transfer conductance U·A, derived from duty and LMTD",
      "units": [
        "kW/K",
        "W/K"
      ],
      "signal_type_prefixes": [
        "derived.ua"
      ],
      "name_hints": [
        "ua",
        "u_value"
      ]
    },
    {
      "role": "hot_side_dp",
      "quantity": "hot-side pressure drop",
      "units": [
        "kPa",
        "bar"
      ],
      "signal_type_prefixes": [
        "process.pressure.differential.hot"
      ],
      "name_hints": [
        "hot_dp",
        "shell_dp"
      ]
    },
    {
      "role": "cold_side_dp",
      "quantity": "cold-side pressure drop",
      "units": [
        "kPa",
        "bar"
      ],
      "signal_type_prefixes": [
        "process.pressure.differential.cold"
      ],
      "name_hints": [
        "cold_dp",
        "tube_dp",
        "cw_dp"
      ]
    },
    {
      "role": "low_side_pressure",
      "quantity": "pressure on the lower-pressure side",
      "units": [
        "bar",
        "kPa"
      ],
      "signal_type_prefixes": [
        "process.pressure"
      ],
      "name_hints": [
        "low_p",
        "shell_p",
        "cw_p"
      ]
    },
    {
      "role": "contamination",
      "quantity": "contamination analyser on the receiving side (conductivity, hydrocarbon, pH)",
      "units": [
        "µS/cm",
        "ppm",
        "pH"
      ],
      "signal_type_prefixes": [
        "process.analyzer"
      ],
      "name_hints": [
        "cond",
        "conductivity",
        "hc_",
        "analy"
      ]
    },
    {
      "role": "shell_pressure",
      "quantity": "condensing-side (shell) pressure or vacuum",
      "units": [
        "kPa",
        "mbar",
        "bar"
      ],
      "signal_type_prefixes": [
        "process.pressure.shell"
      ],
      "name_hints": [
        "shell_p",
        "vacuum",
        "cond_p"
      ]
    },
    {
      "role": "subcooling",
      "quantity": "condensate subcooling (saturation temperature − condensate temperature), derived",
      "units": [
        "K",
        "°C"
      ],
      "signal_type_prefixes": [
        "derived.subcooling"
      ],
      "name_hints": [
        "subcool"
      ]
    },
    {
      "role": "vent_temperature",
      "quantity": "non-condensable vent line temperature",
      "units": [
        "°C",
        "C"
      ],
      "signal_type_prefixes": [
        "process.temperature.vent"
      ],
      "name_hints": [
        "vent_t"
      ]
    },
    {
      "role": "bypass_valve_command",
      "quantity": "exchanger bypass valve command",
      "units": [
        "%"
      ],
      "signal_type_prefixes": [
        "control.command",
        "control.output"
      ],
      "name_hints": [
        "byp_cmd",
        "bypass_op"
      ]
    },
    {
      "role": "bypass_valve_position",
      "quantity": "exchanger bypass valve position",
      "units": [
        "%"
      ],
      "signal_type_prefixes": [
        "control.position"
      ],
      "name_hints": [
        "byp_pos",
        "bypass_fb"
      ]
    }
  ],
  "patterns": [
    {
      "pattern_id": "heat_exchanger.fouling",
      "version": "1.0.0",
      "failure_mode": "fouling",
      "title": "Fouling (loss of heat-transfer coefficient)",
      "category": "process",
      "severity": "warning",
      "description": "Scale, biofilm, corrosion products or process deposits add thermal resistance. U·A falls and the approach temperature widens at the same flows and inlet temperatures; deposits also raise pressure drop.",
      "typical_progression": "Weeks to months; seasonal with cooling-water temperature and treatment.",
      "required_roles": [
        "ua"
      ],
      "optional_roles": [
        "approach_temperature",
        "hot_outlet_temperature",
        "cold_outlet_temperature",
        "hot_side_dp",
        "cold_side_dp"
      ],
      "trigger_role": "ua",
      "symptoms": [
        {
          "role": "ua",
          "direction": "fall",
          "onset_lag_ms": [
            0,
            0
          ],
          "weight": 1.0,
          "threshold_hint": {
            "relative_to_nominal": 0.85
          },
          "note": "U·A below ~85 % of clean value at comparable conditions"
        },
        {
          "role": "approach_temperature",
          "direction": "rise",
          "onset_lag_ms": [
            0,
            0
          ],
          "weight": 0.9
        },
        {
          "role": "hot_outlet_temperature",
          "direction": "rise",
          "onset_lag_ms": [
            0,
            2592000000
          ],
          "weight": 0.7,
          "note": "If the controller cannot compensate"
        },
        {
          "role": "cold_outlet_temperature",
          "direction": "fall",
          "onset_lag_ms": [
            0,
            2592000000
          ],
          "weight": 0.5,
          "note": "Less heat picked up"
        },
        {
          "role": "cold_side_dp",
          "direction": "rise",
          "onset_lag_ms": [
            0,
            5184000000
          ],
          "weight": 0.5,
          "note": "Deposit reduces flow area"
        }
      ],
      "mechanism": {
        "nodes": [
          {
            "id": "dep",
            "label": "Deposit thickness ↑",
            "kind": "cause"
          },
          {
            "id": "rf",
            "label": "Fouling resistance ↑",
            "kind": "state"
          },
          {
            "id": "ua",
            "label": "U·A ↓",
            "kind": "symptom",
            "role": "ua"
          },
          {
            "id": "tw",
            "label": "Cold-side wall temperature ↑",
            "kind": "state"
          },
          {
            "id": "dp",
            "label": "Pressure drop ↑",
            "kind": "symptom",
            "role": "cold_side_dp"
          },
          {
            "id": "v",
            "label": "Velocity ↓",
            "kind": "state"
          }
        ],
        "edges": [
          {
            "from": "dep",
            "to": "rf",
            "sign": "+"
          },
          {
            "from": "rf",
            "to": "ua",
            "sign": "-"
          },
          {
            "from": "ua",
            "to": "tw",
            "sign": "-",
            "loop_id": "scale_temp"
          },
          {
            "from": "tw",
            "to": "dep",
            "sign": "+",
            "lag_ms": [
              604800000,
              15552000000
            ],
            "loop_id": "scale_temp"
          },
          {
            "from": "dep",
            "to": "dp",
            "sign": "+"
          },
          {
            "from": "dp",
            "to": "v",
            "sign": "-",
            "loop_id": "velocity_fouling"
          },
          {
            "from": "v",
            "to": "dep",
            "sign": "-",
            "lag_ms": [
              604800000,
              15552000000
            ],
            "loop_id": "velocity_fouling"
          }
        ],
        "loops": [
          {
            "loop_id": "scale_temp",
            "polarity": "reinforcing",
            "description": "Inverse-solubility salts deposit faster on a hotter wall."
          },
          {